Cutscenes\CutsceneEnd3.tscn	visible			[node name="MarginContainer" type="MarginContainer" parent="."]	true	[EOL]
Menu_Test.gd	gd	496	0	Strange experimental caseless pistol created by an ancient civilization. Foul odour, who knows where this has been.	古代文明によって作られた奇妙な試験的ケースレスピストルです。悪臭がしますが、どこで使われていたのでしょうか。	[EOL]
Menu_Test.gd	gd	498	0	Stern M17	Stern M17	[EOL]
Menu_Test.gd	gd	499	0	Winner of the advanced combat rifle program. Has widely replaced most other rifles in elite military use. Rapid three round burst of flechette rounds significantly increases hit probability.	新型コンバット・ライフル計画の勝者です。エリート部隊で使用される他の殆どのライフルに取って代わり、広く普及しています。フレシェット弾（訳注：貫通力の高い矢のような形状の銃弾）の高速3点バーストは命中率を大幅に向上させます。	[EOL]
Menu_Test.gd	gd	501	0	Parasonic C3 DNA Scrambler	Parasonic C3 DNA Scrambler	[EOL]
Menu_Test.gd	gd	502	0	High value targets often have immediate access to body reconstruction services and as such it has become a popular choice to mangle their genetic makeup beyond all repair with a hi-tech weapon like the Parasonic C3.	「Parasonic C3 DNA混交機」\n価値の高い標的は肉体の再構築サービスをすぐに利用できることが多いため、Parasonic C3のようなハイテク兵器で遺伝子を修復不可能なまでに破壊するのが一般的な選択となっています。	[EOL]
Menu_Test.gd	gd	504	0	Fiberglass Fishing Rod	Fiberglass Fishing Rod	[EOL]
Menu_Test.gd	gd	505	0	Enter the World of Fish and become who you were meant to be.	「ガラス繊維釣り竿」\n魚の世界に飛び込んで本来の自分になりましょう。	[EOL]
Menu_Test.gd	gd	507	0	RPO-80 Sanitization System	RPO-80 Sanitization System	[EOL]
Menu_Test.gd	gd	508	0	Janitorial work in the age of bioprinters and homebrew infectious disease follows these simple rules: Contain, Purify, Control.	「RPO-80 浄化システム」\nバイオプリンターと自作感染症の時代における清掃作業は以下のシンプルなルールに従います： 収容、浄化、制御。	[EOL]
Menu_Test.gd	gd	510	0	ZKZ Transactional Rifle	ZKZ Transactional Rifle	[EOL]
Menu_Test.gd	gd	511	0	Primordial weapon attuned to the beating heart of the financial system.	「ZKZ 取引ライフル」\n金融システムの脈動に同調する最初の武器です。	[EOL]
Menu_Test.gd	gd	513	0	Parasonic MP-1 Nailer	Parasonic MP-1 Nailer	[EOL]
Menu_Test.gd	gd	514	0	Parasonic's new personal defense weapon provides never before seen firepower in a compact form factor. Fires ultra high velocity depleted uranium nails from a high-capacity helical magazine.	「Parasonic MP-1 釘打ち機」\nParasonicの新しい個人用護身武器は、軽量級においてこれまでにない火力を提供します。大容量のhelical magazine（訳注：螺旋状の弾倉）から超高速で劣化ウランの釘を発射するのです。	[EOL]
Menu_Test.gd	gd	516	0	Raymond Shocktroop Tactical	Raymond Shocktroop Tactical	[EOL]
Menu_Test.gd	gd	517	0	A compact but powerful semi-automatic shotgun, popular in the law enforcement business for clearing out regenerative art communes.	（訳注：shocktroopは突撃兵の意）\nコンパクトだが強力なセミオートマチックショットガンで、regenerative art（訳注：再生芸術。オリジナリティの無い模倣のみの芸術） commune（訳注：この場合はregenerative off-grid art communeの事かもしれない）を一掃するための法執行業務で人気があります。	[EOL]
Menu_Test.gd	gd	519	0	Abscess Ironworks Lux ff374f727ce9d6d6e93be0793733c321	Abscess Ironworks Lux ff374f727ce9d6d6e93be0793733c321	[EOL]
Menu_Test.gd	gd	520	0	Bask in the golden light of your radiant path.	（訳注：luxはラテン語で光の意）\nあなたの輝かしい生き方（path）から放たれる黄金の光を浴びましょう。	[EOL]
Menu_Test.gd	gd	522	0	Start Mission	Start Mission	[EOL]
Menu_Test.gd	gd	524	0	BUTTON ERROR	BUTTON ERROR	[EOL]
Menu_Test.gd	gd	579	0	$	$	[EOL]
Menu_Test.gd	gd	622	0	Active Play Time:\n	Active Play Time:\n	[EOL]
Menu_Test.gd	gd	1091	0	WOW	WOW	[EOL]
Menu_Test.gd	gd	1231	0	FOV: 	FOV: 	[EOL]
Menu_Test.gd	gd	1341	0	Left: 	Left: 	[EOL]
Menu_Test.gd	gd	1344	0	Right: 	Right: 	[EOL]
Menu_Test.gd	gd	1347	0	Forward: 	Forward: 	[EOL]
Menu_Test.gd	gd	1350	0	Back: 	Back: 	[EOL]
Menu_Test.gd	gd	1353	0	Jump: 	Jump: 	[EOL]
Menu_Test.gd	gd	1356	0	Shoot: 	Shoot: 	[EOL]
Menu_Test.gd	gd	1359	0	Use: 	Use: 	[EOL]
Menu_Test.gd	gd	1362	0	Kick: 	Kick: 	[EOL]
Menu_Test.gd	gd	1365	0	Reload: 	Reload: 	[EOL]
Menu_Test.gd	gd	1368	0	Lean Left: 	Lean（傾く） Left:	[EOL]
Menu_Test.gd	gd	1371	0	Lean Right: 	Lean（傾く） Right:	[EOL]
Menu_Test.gd	gd	1374	0	Zoom: 	Zoom: 	[EOL]
Menu_Test.gd	gd	1377	0	Weapon 1: 	Weapon 1: 	[EOL]
Menu_Test.gd	gd	1380	0	Weapon 2: 	Weapon 2: 	[EOL]
Menu_Test.gd	gd	1383	0	Last Weapon: 	Last Weapon: 	[EOL]
Menu_Test.gd	gd	1386	0	Crouch: 	Crouch（しゃがむ）:	[EOL]
Menu_Test.gd	gd	1389	0	Tertiary Weapon: 	Tertiary（第3の） Weapon: 	[EOL]
Menu_Test.gd	gd	1392	0	Throw Weapon: 	Throw Weapon: 	[EOL]
Menu_Test.gd	gd	1395	0	Suicide: 	Suicide: 	[EOL]
Menu_Test.gd	gd	1398	0	Stock Market: 	Stock Market: 	[EOL]
Menu_Test.gd	gd	1415	0	Civilians: 	Civilians: 	[EOL]
Menu_Test.gd	gd	1415	1	%	%	[EOL]
Menu_Test.gd	gd	1418	0	Civilians: MAX	Civilians: MAX	[EOL]
Menu_Test.gd	gd	1425	0	Draw Distance:\n	描画距離:\n	[EOL]
Menu_Test.gd	gd	1439	0	Reset level progression?	levelの進行状況をリセットしますか？	[EOL]
Menu_Test.gd	gd	1455	0	This will reset all of your progress. Are you sure?	あなたの進行状況は全てリセットされます。よろしいですか？	[EOL]
Menu_Test.gd	gd	1464	0	Active Play Time:\n0.0.0	Active Play Time:\n0.0.0	[EOL]
Menu_Test.gd	gd	1493	0	N/A	N/A	[EOL]
Menu_Test.gd	gd	1496	0	N/A	N/A	[EOL]
Menu_Test.gd	gd	1498	0	N/A	N/A	[EOL]
Menu_Test.gd	gd	1500	0	N/A	N/A	[EOL]
Menu_Test.gd	gd	1538	0	Gamma: 	ガンマ値: 	[EOL]
Menu_Test.gd	gd	1555	0	Active Play Time:\n0.0.0	Active Play Time:\n0.0.0	[EOL]
Scripts\Berries.gd	gd	36	0	You ate pills.	錠剤を飲んだ。	[EOL]
Scripts\Destructible_Armored.gd	gd	40	0	Small cracks permeate the surface	小さな亀裂が表面に広がっている。	[EOL]
Scripts\Dialogue.gd	gd	8	0	Here to improve your aim?	ここにはエイム力を鍛えに来たのか？	[EOL]
Scripts\Dialogue.gd	gd	9	0	I love spending time at the lounge, it's so relaxing. All my worries just melt away.	俺はラウンジで過ごす時間が大好きだ。とてもリラックスできるからな。悩みが全部すっと溶けていく感じだね。	[EOL]
Scripts\Dialogue.gd	gd	10	0	They just finished renovating the kill box. It's quite something now.	kill boxの改修がちょうど終わったばかりだよ。かなり立派になったみたいだ。	[EOL]
Scripts\Dialogue.gd	gd	11	0	This place has a mysterious atmosphere don't you think?	この場所には神秘的な雰囲気があると思わないかい？	[EOL]
Scripts\Dialogue.gd	gd	12	0	I can occasionally hear somebody talking when nobody else is here. It's upsetting.	ここでは誰もいないのにたまに誰かの話し声が聞こえるんだ。ビビるぜ。	[EOL]
Scripts\Dialogue.gd	gd	13	0	I've heard the rumors about what happened at your last job. Don't let it get to you buddy, we're all here for you.	君の前職で何があったのか、噂には聞いている。だがまぁ、気にするな。みんな君の味方だ。	[EOL]
Scripts\Dialogue.gd	gd	14	0	You seem cool.	お前クールだな。	[EOL]
Scripts\Dialogue.gd	gd	15	0	Coming here is literally therapy to me.	ここに来ることは私にとって文字通りセラピーなんだ。	[EOL]
Scripts\Dialogue.gd	gd	16	0	I've heard rumors of a weapon older than God that taps into the unbound potential of the financial world. Has to be bullshit.	財界（financial world）の潜在力を引き出して扱える、神よりも古い武器の噂を聞いたことがある。戯言に違いないが。	[EOL]
Scripts\Dialogue.gd	gd	17	0	I fucked up my last job pretty bad. I got the targets but accidentally got a bunch of civilians killed. Still got paid of course but I feel pretty bad.	前回の仕事は大失敗だったよ。目標は達成したが、誤って民間人をたくさん死なせてしまった。それでももちろん給料はもらえたけど、とても後悔しているんだ。	[EOL]
Scripts\Dialogue.gd	gd	18	0	What's your favorite weapon? I'm really into anything that shoots flechettes.	お前の好きな武器は？俺はフレシェットを撃つものなら何でも好きだよ。	[EOL]
Scripts\Dialogue.gd	gd	19	0	It's a good idea to take a break every now and then...	たまには休憩するのもいいかもしれないよ…	[EOL]
Scripts\Dialogue.gd	gd	20	0	Some day I would like to meet Elsa Holmes.	いつかElsa Holmesに会ってみたいんだ。	[EOL]
Scripts\Dialogue.gd	gd	23	0	I can't talk right now I'm running late.	今は遅刻しそうだから話していられないんだ。	[EOL]
Scripts\Dialogue.gd	gd	24	0	Boss has been bullying me all the time recently, I hope someone kills him.	ボスが最近いつも俺をいじめてくるんだ。誰かあいつを殺してくれないかな。	[EOL]
Scripts\Dialogue.gd	gd	25	0	I'm so tired of cleaning up excrement. Why me?	クソを掃除するのはもううんざりだ。なぜ俺が？	[EOL]
Scripts\Dialogue.gd	gd	26	0	Yawn	Yawn（訳注：あくびという意味の単語だが英語ではこれをオノマトペとしても用いる）	[EOL]
Scripts\Dialogue.gd	gd	27	0	Have you tried the new Coffee Burger? That shit slaps.	新しいコーヒー・バーガーは食べてみたか？むっちゃうまかったぜ。	[EOL]
Scripts\Dialogue.gd	gd	28	0	I wish I was at home playing Gorbino's Quest.	家でGorbino's Questをプレイしていたかったよ。	[EOL]
Scripts\Dialogue.gd	gd	29	0	What did they do to your face?	その顔、何をされたんだ？	[EOL]
Scripts\Dialogue.gd	gd	30	0	Holy fuck you're ugly.	お前はなんて醜いんだ。	[EOL]
Scripts\Dialogue.gd	gd	31	0	What's that smell?	この臭いは何だ？	[EOL]
Scripts\Dialogue.gd	gd	32	0	I'm so fucking tired.	すっごく疲れたよ。	[EOL]
Scripts\Dialogue.gd	gd	33	0	We've made a breakthrough in combinining rat and human DNA. The result isn't exactly what we expected though...	我々はネズミとヒトのDNAを結合させるという画期的な研究を成し遂げた。しかし、その結果は我々が期待していたようなものではなかったのだ…	[EOL]
Scripts\Dialogue.gd	gd	34	0	The smells from the lab make me nauseous. There's something wrong with the ventilation system here.	研究室からの匂いで吐き気がするんだ。ここの換気システムはおかしいよ。	[EOL]
Scripts\Dialogue.gd	gd	35	0	Ever since I slipped and hit my head I've been craving Hungry Human Soda.	滑って頭を打って以来、Hungry Human Sodaが飲みたくてたまらない。	[EOL]
Scripts\Dialogue.gd	gd	38	0	Weird mushrooms keep growing on my lawn. I really don't need this shit in my life right now.	うちの芝生に変なキノコが生え続けているんだ。こんなクソみたいなもの、私の生活には必要ないよ。	[EOL]
Scripts\Dialogue.gd	gd	39	0	My neighbor loves deconstructed classic rock. That's fine but he should get headphones.	私の隣人は脱構築（訳注：deconstructed。一旦要素に分解した後再構築する事）クラシック・ロックが大好きだ。それはいいんだが、彼にはヘッドフォンを買ってもらいたいね。	[EOL]
Scripts\Dialogue.gd	gd	40	0	Do you hear that screaming?	君にはあの叫び声が聞こえるか？	[EOL]
Scripts\Dialogue.gd	gd	41	0	What are you doing here?	ここで何をしているんだ？	[EOL]
Scripts\Dialogue.gd	gd	42	0	Are you one of those open carry guys? I respect that.	君はオープン・キャリー（訳注：銃を隠さずに携帯する事）派なのかい？私はそれを尊重しているよ。	[EOL]
Scripts\Dialogue.gd	gd	43	0	They're trying to make it legal to cook meth. Don't get me wrong I'm into freedom but that's a step too far.	彼らはmeth（訳注：Methamphetamineの略。覚醒剤の事）の製造を合法化しようとしている。誤解しないでほしいが、私は自由が大事だと思っている。しかしそれは行き過ぎだ。	[EOL]
Scripts\Dialogue.gd	gd	44	0	I really look up to people who are good at violence.	私は暴力が得意な人を本当に尊敬しているんだ。	[EOL]
Scripts\Dialogue.gd	gd	45	0	Who doesn't love a good peeperoni pizza after a hard day of trading? I mean pepperoni.	厳しい取引の一日を終えた後に食べるペパロニ・ピザが嫌いな人はいないだろう。何といってもペパロニだからな。	[EOL]
Scripts\Dialogue.gd	gd	48	0	One day I'll be on that rocket to Mercury. Then my dad will respect me.	いつか水星行きのロケットに乗るんだ。そうしたら父さんは僕を認めてくれるだろう。	[EOL]
Scripts\Dialogue.gd	gd	49	0	Working conditions here are quite rough but it's all for the greater good. Some sacrifices have to be made.	ここの労働条件はかなり厳しいが、すべては大義のためだ。多少の犠牲は払わなければならない。	[EOL]
Scripts\Dialogue.gd	gd	50	0	Oh you're one of the new security hires?	あれ、君は新しい警備員の人なのかい？	[EOL]
Scripts\Dialogue.gd	gd	51	0	Did you know we also make tactical nuclear warheads? That's how we fund the space business. Pretty cool.	我々は戦術核弾頭も製造していることをご存知ですか？実はそれが宇宙ビジネスの資金源なのです。なかなかクールですね。	[EOL]
Scripts\Dialogue.gd	gd	52	0	The space elevator construction is behind schedule. It's making me depressed.	宇宙エレベーターの建設が予定より遅れている。憂鬱な話だ。	[EOL]
Scripts\Dialogue.gd	gd	53	0	I've heard weird noises from the server room... Hope it's not fleshrats.	サーバールームから変な音がするんだ… fleshratでないことを願うよ。	[EOL]
Scripts\Dialogue.gd	gd	54	0	What are you talking about? If I didn't believe in what I was doing I'd simply leave and find another job.	何を言っているんだ？自分のやっていることが信じられなければ、ただ辞めて別の仕事を探すだけさ。	[EOL]
Scripts\Dialogue.gd	gd	55	0	According to the latest research the living conditions on Mercury aren't that bad.	最新の研究によると、水星の生活環境はそれほど悪くない。	[EOL]
Scripts\Dialogue.gd	gd	58	0	...	…	[EOL]
Scripts\Dialogue.gd	gd	59	0	I just want to go home.	俺はただ家に帰りたいだけなんだ。	[EOL]
Scripts\Dialogue.gd	gd	60	0	I've lost count of days.	もう何日経ったかわからない。	[EOL]
Scripts\Dialogue.gd	gd	61	0	Keep having these recurring nightmares about transforming into a bouncy castle... It's freaking me out.	bouncy castle（訳注：弾む或いは生き生きした城）に変身する悪夢を繰り返し見るんだ… 怖くてたまらないよ。	[EOL]
Scripts\Dialogue.gd	gd	62	0	I don't know where the food they give us here comes from. I swear it moves sometimes and the headache it gives me is something else.	ここで彼らが配っている食べ物がどこから来たものなのか分からないんだ。そいつが時々動くのと、食べた後に頭痛がするのは別々の理由からだって事は確かだね。	[EOL]
Scripts\Dialogue.gd	gd	63	0	The sounds here at night... I don't know, I just don't.	夜中にここで聞こえる音は… 分からない、分からないんだ。	[EOL]
Scripts\Dialogue.gd	gd	64	0	Someone's in my head. I can feel someone else's body as if it was mine.	誰かが俺の頭の中にいるんだよ。それに他人の体を自分の体のように感じてしまうんだ。	[EOL]
Scripts\Dialogue.gd	gd	67	0	So apparently the fleshrats just escaped from some biotech lab? Great job.	見たところバイオテクノロジー研究所からfleshratたちが脱走したらしいな？良くやった。	[EOL]
Scripts\Dialogue.gd	gd	68	0	I'm here to buy Chunkopops for my son. He can't get enough of that plastic crap.	ここにはうちの息子のためにChunkopopを買いに来たんだ。あいつはあのプラスチックのガラクタでは満足できないんだよ。	[EOL]
Scripts\Dialogue.gd	gd	69	0	Dropped by GamesGames only to find out they're all out of Gorbino's Quest. Do you know about artificial scarcity?	GamesGamesに立ち寄ったけど、Gorbino's Questが売り切れだった。人為的な希少性（訳注：artificial scarcity。十分な生産・流通能力があるにも関らず生じる商品の希少性の事。価格吊上げの為の独占などの理由で発生する）って知ってる？	[EOL]
Scripts\Dialogue.gd	gd	70	0	Had a meat lover's at the Pizza House. I think the Meatoids they put on them have become worse quality recently.	Pizza Houseでmeat lover'sを食べたんだけどね、ピザに乗っているMeatoidの質が近ごろ悪くなっている気がするんだ。	[EOL]
Scripts\Dialogue.gd	gd	71	0	The Donut World at the main plaza is completely overrun by cops due to the rally. I really wanted to feast on some of those delicious treats.	メインプラザにあるDonut Worldは、集会のせいで警官に完全に制圧されているよ。本当にあのおいしいお菓子を食べたかったんだけどなぁ。	[EOL]
Scripts\Dialogue.gd	gd	72	0	I simply adore the Megamall atmosphere. The hustle and bustle, the beat of the city, the squirming chthonic energy. Magnificent.	私はMegamallの雰囲気が大好きなんだ。賑わいと喧騒（hustle and bustle）、街のビート、もがき苦しむ人々のエネルギー（chthonic energy）。素晴らしい。	[EOL]
Scripts\Dialogue.gd	gd	73	0	Apparently there's a minor fleshrat infestation going on here... Thankfully haven't seen any myself.	どうやらここでは小規模なfleshratの異常発生が起こっているようなんだ… ありがたいことに僕自身は見たことがないけど。	[EOL]
Scripts\Dialogue.gd	gd	74	0	If you put your ear against the wall you might hear the mall speak. That's what the urban legend says anyways.	壁に耳を当てると、モールでの話し声が聞こえるかもしれないよ。そういう都市伝説があるんだ。	[EOL]
Scripts\Dialogue.gd	gd	75	0	Punishment huh... What's that?	罰（punishment）って…へへ、何だいそれ？	[EOL]
Scripts\Dialogue.gd	gd	76	0	You're here to protect the governor? Don't take this personally, I don't like him. He's making life hard for people of wealth.	知事を守るために来たのか？個人的な感情は抜きにして、私は彼が好きではない。彼は裕福な人々の生活を苦しめている。	[EOL]
Scripts\Dialogue.gd	gd	79	0	They say I have to live here because I've sinned.	奴らは俺が罪を犯したからここに住まなければならないと言うんだ。	[EOL]
Scripts\Dialogue.gd	gd	80	0	This place reeks of mold and shit. If I had a choice I'd pack my things and leave immediately.	ここはカビとクソの臭いがする。もし僕に選択の余地があったら、荷物をまとめてすぐに出て行くよ。	[EOL]
Scripts\Dialogue.gd	gd	81	0	What's with the commotion?	この騒ぎは何だ？	[EOL]
Scripts\Dialogue.gd	gd	82	0	Hello neighbor!	こんにちは、お隣さん！	[EOL]
Scripts\Dialogue.gd	gd	83	0	I can't sleep.	眠れないんだ。	[EOL]
Scripts\Dialogue.gd	gd	84	0	Last night I got up to take a piss and guess what I saw? A real live fleshrat! I immediately reached for my home defence xiphos and sliced that fucker.	昨夜、小便をしようと思って起きたら、何を見たと思う？本物の生きたfleshratだ！俺はすぐさま家の防衛用xiphos（訳注：古代ギリシアの両刃剣）に駆け寄って、そのクソを切りつけたのさ。	[EOL]
Scripts\Dialogue.gd	gd	85	0	Third time the cops come here this week. Why can't they just let us live?	今週、警官がここに来るのは3度目だ。どうして私たちを生かしておいてくれないんだ？	[EOL]
Scripts\Dialogue.gd	gd	86	0	Saw a big guy with crazy eye implants and a huge gun... Didn't seem like a cop to me. Do you know what's up?	イカれた目をして、でっかい銃をインプラントした大男を見たんだ… 俺にはとても警官に見えなかった。何があったのか知ってるか？	[EOL]
Scripts\Dialogue.gd	gd	89	0	I just love the salty sea air.	僕は海の塩辛い空気が大好きなんだ。	[EOL]
Scripts\Dialogue.gd	gd	90	0	When I heard about the opportunity to live here as a permanent resident I immediately took the chance. I don't regret it one bit.	永住権を持ってここに住むチャンスがあると聞いて、私は即座にそのチャンスをつかんだ。少しも後悔していないよ。	[EOL]
Scripts\Dialogue.gd	gd	91	0	I never had sex before I moved here but now I'm fucking a different bioslave every day.	ここに来る前はセックスなんてしたことなかったけど、今では毎日違うbioslaveとヤッてるぜ。	[EOL]
Scripts\Dialogue.gd	gd	92	0	We finally have it, we're fully sovereign. Just a couple of shareholders grabbing hold of their destinies on the open seas. Beautiful.	我々はついに手に入れた。完全に主権を確立したのだ。ちょうど大海原で運命をつかみ取る株主（shareholders）のカップルのように。素晴らしい。	[EOL]
Scripts\Dialogue.gd	gd	93	0	If you think about it, the joint-stock company truly is the perfect model for all governance.	君もよく考えれば、合本会社（訳注：joint-stock company。譲渡可能な株式によって出資した株主に分割所有される企業形態。通常の株式会社とは株主が負債に対し無限責任を負う、などの違いがある。）は全ての統治機構にとって真に完璧なモデルなのだと分かるだろう。	[EOL]
Scripts\Dialogue.gd	gd	94	0	This is just the beginning. Soon there will be others like us.	これは始まりに過ぎない。近いうちに私たちのような者が他にも現れるだろう。	[EOL]
Scripts\Dialogue.gd	gd	95	0	Some say biocurrency is disgusting, to me it's a natural evolution.	生体通貨（biocurrency）は嫌だと言う者もいるが、私にとっては自然な進化だ。	[EOL]
Scripts\Dialogue.gd	gd	96	0	Don't get too excited my boy. Oh my ahahaha.	あまり興奮するなよ、少年。 少ねアハハハ。	[EOL]
Scripts\Dialogue.gd	gd	97	0	First we conquer the sea, then space. I have already reserved a spot on the Advanced Orbital Instruments mission to Mercury.	我々はまず海を征服し、次に宇宙を征服する。 私はすでに水星へのAdvanced Orbital Instrumentsの計画の参加枠を予約しているんだ。	[EOL]
Scripts\Dialogue.gd	gd	98	0	Facts about the average Titanium Princess resident: High IQ, software developer, INTJ. That's me.	Titanium Princessの平均的な居住者についての事実： 高IQ、ソフトウェア開発者、INTJ（訳注：性格診断テストの類型の1つ。内向型 (Introvertion)、直観型 (iNtuition)、思考型 (Thinking)、判断型 (Judging) の頭文字を取ったもの）。それが僕。	[EOL]
Scripts\Dialogue.gd	gd	101	0	OOOHHHHOHOHOOOO	OOOHHHHOHOHOOOO	[EOL]
Scripts\Dialogue.gd	gd	102	0	OOOHH AHHHAHA	OOOHH AHHHAHA	[EOL]
Scripts\Dialogue.gd	gd	103	0	HHAHAHHA	HHAHAHHA	[EOL]
Scripts\Dialogue.gd	gd	106	0	The prizes aren't so good. Definitely not worth it. Yet here I am.	賞品はそれほど良くない。 間違いなくその価値はない。それでも俺はここにいるんだ。	[EOL]
Scripts\Dialogue.gd	gd	107	0	I'm cursed with bad luck.	僕は不運に呪われているんだ。	[EOL]
Scripts\Dialogue.gd	gd	108	0	First they string you in with a victory streak, then when you're feeling good about yourself they make you lose everything.	奴らは最初のうちは連勝で君を繋ぎ止め、調子に乗ったところで全てを失わせるんだ。	[EOL]
Scripts\Dialogue.gd	gd	109	0	I heard the jackpot from the GunMachine is very powerful, some kind of advanced superweapon.	GunMachineのジャックポットは非常にパワフルで、ある種の先進的な超兵器だと聞いている。	[EOL]
Scripts\Dialogue.gd	gd	110	0	Some people are just natural winners, not me.	ある種の人たちは生まれつきの勝者だ。俺は違う。	[EOL]
Scripts\Dialogue.gd	gd	111	0	I'm financially successful, I'm desirable, I'm a multi-millionaire, I will get what I want. I'm a multi-millionaire...	私は経済的に成功している、私は魅力的だ、私は数百万長者（multi-millionaire）だ、私は欲しいものを必ず手に入れる。私は数百万長者だ…	[EOL]
Scripts\Dialogue.gd	gd	112	0	The atmosphere here is so fancy, it makes you feel rich even if you're not.	ここの雰囲気は高級感にあふれていて、たとえ君がそうでないとしてもリッチな気分にさせてくれるぞ。	[EOL]
Scripts\Dialogue.gd	gd	113	0	Interior design is all about minimal scandinavian sewers right now. It's so elegant.	インテリアデザインは今、ミニマルなscandinavian sewers（訳注：下水管または裁縫職人）一色です。とてもエレガントですよ。	[EOL]
