Cutscenes\Consumerintro.tscn	DURATION			[node name="Spatial" type="Spatial"]	7	[EOL]
Cutscenes\Cutscene1.tscn	DURATION			[node name="Spatial" type="Spatial"]	6	6.0	6.0	6.0	6.0	6.0	6.0	6.0	6.0	6.0	6.0	6.0	6.0	6.0	4.0	[EOL]
Cutscenes\CutsceneEnd1.tscn	DURATION			[node name="Spatial" type="Spatial"]	13	7.0	7.0	7.0	7.0	7.0	7.0	7.0	7.0	7.0	20.0	100.0	[EOL]
Cutscenes\CutsceneEnd2.tscn	DURATION			[node name="Spatial" type="Spatial"]	13	7.0	7.0	7.0	7.0	7.0	7.0	7.0	7.0	7.0	20.0	100.0	[EOL]
Cutscenes\CutsceneEnd3.tscn	DURATION			[node name="Spatial" type="Spatial"]	13	7.0	7.0	7.0	7.0	7.0	7.0	7.0	7.0	7.0	20.0	110.0	[EOL]
Levels\Training_Level.tscn	DYN_LINES			[node name="Body" parent="NPC_Level_2" index="0"]	[SOB]	N	[EOB]	[SOB]	N	[EOB]	[SOB]	\"N\"	[EOB]	[SOB]	I was working as security for those G-Tech guys until you came along and liberated me.	I'm extremely thankful, one of them would keep showing me his \"Chunkopops\"...	It was the most miserable two months of my life.	Came here looking for a new job.	[EOB]	[SOB]	N	[EOB]	[SOB]	N	[EOB]	[SOB]	N	[EOB]	[SOB]	N	[EOB]	[SOB]	N	[EOB]	[SOB]	N	[EOB]	[SOB]	N	[EOB]	[SOB]	N	[EOB]	[SOB]	N	[EOB]	[EOL]
Levels\Training_Level.tscn	DYN_LINES			[node name="Body" parent="NPC_Level_3" index="0"]	[SOB]	N	[EOB]	[SOB]	N	[EOB]	[SOB]	N	[EOB]	[SOB]	N	[EOB]	[SOB]	I got laid off by the Gutworx labour hire company.	It made me really depressed for a while. I really enjoyed cleaning up the space elevator construction site.	All of a sudden there was some kind of change in management and all the janitors were kicked out...	Thankfully it didn't take long for me to get this new job. Liquidators  seem to leave a huge mess behind everywhere they go..	This place smelled absolutely unbelievable when I first got here.	Sorry for keeping you like this, you seem busy.	[EOB]	[SOB]	N	[EOB]	[SOB]	N	[EOB]	[SOB]	N	[EOB]	[SOB]	N	[EOB]	[SOB]	N	[EOB]	[SOB]	N	[EOB]	[SOB]	N	[EOB]	[SOB]	N	[EOB]	[EOL]
Levels\Training_Level.tscn	DYN_LINES			[node name="Body" parent="NPC_Level_4" index="0"]	[SOB]	N	[EOB]	[SOB]	N	[EOB]	[SOB]	N	[EOB]	[SOB]	N	[EOB]	[SOB]	N	[EOB]	[SOB]	You really blasted up the PD huh? Can't say I blame you.	The whole place is in complete disarray as people are fighting for power and trying to figure out a new source of steroids.	I had been planning to quit for a while, the oppressive work environment just wasn't working out for me.	Private security was the obvious choice so here I am. I even get to decide my own working hours here, so nice!	I'm extremely grateful that you provided me with this opportunity to finally change the course of my life. Things are looking up.	[EOB]	[SOB]	N	[EOB]	[SOB]	N	[EOB]	[SOB]	N	[EOB]	[SOB]	N	[EOB]	[SOB]	N	[EOB]	[SOB]	N	[EOB]	[SOB]	N	[EOB]	[EOL]
Levels\Training_Level.tscn	DYN_LINES			[node name="Body" parent="NPC_Level_5" index="0"]	[SOB]	N	[EOB]	[SOB]	N	[EOB]	[SOB]	N	[EOB]	[SOB]	N	[EOB]	[SOB]	N	[EOB]	[SOB]	N	[EOB]	[SOB]	I lost my job at the Megamall for poor handling of security during the Gurney's rally.	I had the place crawling with police deathmechs, what else could I possibly have done?	Now I'm doing accounting here. It's not so bad. Starting to get the hang of it.	This room is a lot nicer than my last one.	[EOB]	[SOB]	N	[EOB]	[SOB]	N	[EOB]	[SOB]	N	[EOB]	[SOB]	N	[EOB]	[SOB]	N	[EOB]	[SOB]	N	[EOB]	[EOL]
Cutscenes\Cutscene1.tscn	LINES			[node name="Spatial" type="Spatial"]				Hey, it's me. Did I wake you up from your depression nap?	Heard you've been in a rough spot since your discharge\nfrom the SEC Death Unit.	There's not much a fucked up detached loser\nlike you can do after all.	I've got good news for you regarding your employment status.	It's the sort of work that you enjoy but\nyou'll have to adjust to a more corporate mindset.	I've created you an account on MyWork so you can begin whenever you want.	I assume you already own some suitable equipment.	One last thing, you'll have to log\nat least fifteen minutes a day on the conditioning app.	We need your mind primed and clear. No freakouts. Understand?	That should be all. Good luck on your new career path.			[EOL]
Cutscenes\CutsceneEnd1.tscn	LINES			[node name="Spatial" type="Spatial"]		You emerge from a long and weary sleep.	The world appears as a large flat plane of opportunity.	The sky is boundless and blue.	You are among friends.	The air is fresh with the scent of the ocean	You have learned acceptance and forgiveness	But you lack knowledge and understanding.	You will be trapped forever.	The past is ever-present.	The sun smiles at you with eternal malice.		[EOL]
Cutscenes\CutsceneEnd2.tscn	LINES			[node name="Spatial" type="Spatial"]		I weep.	You are a rotten husk.	You overflow with boundless power.	You have the soul of an emperor.	Sacrificial hero. Blessed by primordial luck.	Your friends are in hell yet you smile.	Only good things will come to someone like you.	Set goals. Have a ten year plan. Invest. Wake up early. CEO mindset.	Good luck.			[EOL]
Cutscenes\CutsceneEnd3.tscn	LINES			[node name="Spatial" type="Spatial"]													[EOL]
Entities\Enemies\Chaos_Objective.tscn	LINES			[node name="Body" type="KinematicBody" parent="."]	Eko wls uoarjc pfs wqr fbs\nFor ycf bazjkd szk ezt blp\nZas oai xhvgmq ktl spy\nQEVHUMDKGTASLFNEVHUMDKGTASLFN	[EOL]
Entities\Enemies\E_Civilian_Mutant.tscn	LINES			[node name="Body" type="KinematicBody" parent="."]	AAAAAAAAAAAAAAAAAAAAAAAAAAAAAAAAAAAAAAAAAAAAAAAAAAAAAAAAAAAAAA	[EOL]
Entities\Enemies\E_Cocky.tscn	LINES			[node name="Body" type="KinematicBody" parent="."]	Hey! Nice to meet you. The names Kevin but you can call me Kev.	I'm the speculative architect of this place. No... I didn't design it.	I'm just here to figure out what buildings would look like in uh, alternativies.	I'm currently working on a series of architectural renderings under the title \"In suffering\".	My most recent one, waste management in suffering is a masterpiece.	It's quite an important job. I was recently promoted so I got this kickass office on the second floor away from cubicle losers.	I edit a fleshnet publication called \"Successful Architecture\". It's pretty sick. Check it out sometime my man.	[EOL]
Entities\Enemies\E_Kevin.tscn	LINES			[node name="Body" type="KinematicBody" parent="."]	Hey! Nice to meet you. The names Kevin but you can call me Kev.	I'm the speculative architect of this place. No... I didn't design it.	I'm just here to figure out what buildings would look like in uh, alternativies.	I'm currently working on a series of architectural renderings under the title \"In suffering\".	My most recent one, waste management in suffering is a masterpiece.	It's quite an important job. I was recently promoted so I got this kickass office on the second floor away from cubicle losers.	I edit a fleshnet publication called \"Successful Architecture\". It's pretty sick. Check it out sometime my man.	[EOL]
Entities\Enemies\Obj_Nerd_1.tscn	LINES			[node name="Body" type="KinematicBody" parent="."]	Who are you? Oh you're here to check out my Chunkopops?	I'm absolutely nuts about these little guys. Must have spent over $100000 on them by now.	Do you have a favorite? Me? It's so hard to choose. They're all my children.	Man it's so nice to meet another Chunko enthusiast...	[EOL]
Entities\Enemies\Obj_Nerd_2.tscn	LINES			[node name="Body" type="KinematicBody" parent="."]	Ever heard of Qurpit? One word: Decentralized Personal Server. Take back your data.	You don't understand huh? Typical Earthling...	Leave me alone I'm trying to figure out how to program in Zoon, the Qurpit programming language for Mercurians.	[EOL]
Entities\Enemies\Obj_Nerd_3.tscn	LINES			[node name="Body" type="KinematicBody" parent="."]	Who are you?	Get out of here.	Leave me alone.	What did I just tell you?	I'm trying to work here.	No you can't help.	You're a piece of piss.	...	[EOL]
Entities\Enemies\Obj_Pinky.tscn	LINES			[node name="Body" type="KinematicBody" parent="."]	AAAAAHHHHHH!!!	BIOGURRNGY!!! I AM MONEY... I AM GOD!	INVEST. INVESTIGATE. THE FUTURE OF CURRENCY.	SLURPCOIN DOT COM. FLIPPERBUCKS. PLUGGING MY BODY INTO THE BIOCURRENCY TERMINAL. FUTURE	UUUUUUOOOHHHHHHHOOHOHHOOHHOOHOHHOHOHHOOHHOOHOHHOHOHOHOHHOOHOOHOHOHOHOHOHOOHOHHOOHHOHOHOHHOOHOHOHOOOO	[EOL]
Levels\Bonus1.tscn	LINES			[node name="Body" parent="Creep" index="1"]	Ohhh here he comes, I've been waiting for this.	Will he kick me or shoot me in the head? This is so exciting.	Last time was breathtaking. I'm sure he can't outdo that.	I'd love to be kicked off the roof.	You never know what'll happen next. That's the beauty of life.	I respect your job. It's one of the last few honorable trades left.	Ahhhaha...	Mhhmmm...	[EOL]
Levels\Bonus1.tscn	LINES			[node name="Body" parent="Civilian2" index="1"]	I got really into farming by playing a bunch of Shitville Farmhouse on my expensive gaming PC.	At some point I just wasn't getting anything out of it so I decided I'd started farming for real, in real life.	So here we are, not in a video game, and I have my own agricultural business.	It's a lot easier than the game because I can just make other people do the hard work for me.	It's slurpnip season in Darkworld.	[EOL]
Levels\Bonus2.tscn	LINES			[node name="Body" parent="Civilian3" index="1"]	One more year and I'm going to have enough money to retire for good.	This resort business just isn't for me. Complaining customers and know it alls who think they know how to run this place better than me.	I will NOT add a water slide. Where would it even go?	Sigh... I should have a thicker skin by now.	Thanks for listening, I feel so much better now. I never get to say these things to anyone.	[EOL]
Levels\Bonus2.tscn	LINES			[node name="Body" parent="Civilian4" index="1"]	Please do something about that thing in the bathroom!	I don't know what the fuck that freak is. I know it's the swamp suite but this is a little too swampy even for me.	I called the hotel management hours ago and they still haven't showed up. What a fucking joke.	My security guys are complete cowards and refuse to go in there. Who recruited these absolute morons?	If you deal with this I could even pay you. How's one million dollars sound?	[EOL]
Levels\Bonus2.tscn	LINES			[node name="Body" parent="Civilian5" index="1"]	Can't even take a piss without some freak like you bothering me.	What is it? Be quick about it.	This trip is an absolute disaster. All of our deals have gone to shit. I'm readying myself to declare bankruptcy.	The other guys seem to be more interested in \"relaxing\". I'm the only serious business minded individual here.	You're also one? That's good.	[EOL]
Levels\Bonus2.tscn	LINES			[node name="Body" parent="Civilian" index="0"]	Whoa bro... Where'd you come from?	I'm just chilling. I love the serene view and the nice warm bath. Some of the guys want to do business but I'm in no hurry.	Honestly I knew before coming here that there would be no deal. I just needed an excuse to relax.	I'm definitely coming back here some time. If you happen to meet the owner of this place please tell him how much I appreciate his work.	[EOL]
Levels\Bonus2.tscn	LINES			[node name="Body" parent="Civilian2" index="0"]	You thought that dumbass old man was the one running this magnificent hotel business?	Something this important can't be left to someone like that.	I am a dark CEO. It is a hereditary title. A sort of corporate nobility. We're not into publicity, just pure business.	Weak blood doesn't have what it takes, but everyone needs to be given an opportunity these days. It's fucking messed up...	You don't get a brain like mine without careful breeding.	I'm thinking...	[EOL]
Levels\Bonus3.tscn	LINES			[node name="Body" parent="Civilian2" index="1"]	I'd turn away if I was you.	I'm not sure what's going on here but it's not good.	Are you a poverty tourist? Oh...	[EOL]
Levels\Bonus3.tscn	LINES			[node name="Body" parent="Civilian3" index="1"]	It's only me left in this household now...	Every night they come and take someone. I don't know where or why.	I used to live here with my wife and our bul... Housemate. We never had much but it was a simple and carefree life.	I'm thinking about killing myself before they come for me. Sorry for being so direct. But you haven't seen them.	I used to be a corporate bigshot but that life just wasn't for me. I bought this nice house and settled down.	Things only started getting bad during the last couple of months. The soil turned foul, got a fleshy rotten smell to it. All of our crops died.	Then those things started harassing us. Not just my family but everyone else living in the region.	It gradually got worse and worse. And now everyone's gone.	Please help me find my wife I'm so lonely.	[EOL]
Levels\Bonus3.tscn	LINES			[node name="Body" parent="Civilian4" index="0"]	Oh my god!! Are you here to get me? What have I done?	I swear I'm just trying to make life better for everyone here.	I couldn't handle working for Godhead Heavy Industries anymore, that place is soulsucking and has zero ethics.	Veggo's Meatoids is my baby... I can finally do something to make the world a better place, with 100% vegan earthmeat.	Well technically it's not vegan but I don't think the planet can actually feel.	I hope it doesn't...	[EOL]
Levels\Bonus3.tscn	LINES			[node name="Body" parent="Civilian" index="0"]	Did you meet the owner of that shitty little farmhouse? He's always whining and never doing anything.	I've been living here for five years. I'm always prepared for the worst. Planning on slaughtering all of the freaks living in that mine.	I'm writing a book on my experiences. It's called \"The Destruction of Virility: Doom Anus Apocalypse\"	This is the life for me, here in the countryside. I will never go back to the city.	[EOL]
Levels\Bonus3.tscn	LINES			[node name="Body" parent="Civilian18" index="0"]	Ahhh, I'm having such a great time here!	This place is full of incredible oozing and pulsating holes. Just what a guy like me needs.	The opportunities are limitless. Just use your imagination.	[EOL]
Levels\Bonus4.tscn	LINES			[node name="Body" parent="Civilian2" index="1"]	Woooow you look cool. Nice outfit.	I'm Earl, I run this freaking epic club complex. It used to be a factory of some sort but now its been heh, cleaned up, and looks fucking sick.	I bought like half of this ancient arcology and its made me rich as fuuuuuuuuck.	Fast cars... Luxury vodka... Gaming BIOPOD. You name it, I have it.	I've already set my eyes on another one of these arcologies. Can't believe nobody else has come up with this business yet. It's so easy, and 100% legal.	I have \"party syndrome\"...	[EOL]
Levels\Bonus5.tscn	LINES			[node name="Body" parent="Civilian2" index="1"]	The first of the Triagons was born of malice. It grasped the flow of the solar terror with both hands, and perched on top of this doomed world. The germ is born.	It looked up into the sun. Beyond the veil of power. It extended its bulging vascular arms through the boundary and took its share. The disease spreads.	It assumed total control of the biological shape of things. It became primal engine of technological progress. And so everything started to twist and turn, pulsate and pump. The infection is final.	[EOL]
Levels\Bonus5.tscn	LINES			[node name="Body" parent="Civilian4" index="1"]	The third Triagon was born of Death. It saw that the world was radiating excess energy. It wanted to put great things into motion. But greatness wasn't possible without value. The first transaction.	It took its blade and cut a large hole into the boundary, creating a sudden flash of high volume transactional power. And just for a moment things seeped value into themselves, assuming souls. The second transaction.	The hole was quickly mended, and the overpowering transmission of value was cut short. But in that moment the seed of primordial financial might was planted, and the world took on its transactional form. Conflict and discord emerged, and the third Triagon was ecstatic. The third transaction.	[EOL]
Levels\Bonus5.tscn	LINES			[node name="Body" parent="Civilian3" index="1"]	When the second Triagon descended from the newly emerging mass of Life, the world was mired in confusion and chaos. The overwhelming clutter of biology got on its nerves, it demanded calm. The feeding begins.	It saw visions of guts, of decay and metabolism. The opportunity had come to extend a cavern of intestines deep into the ground. To start processing the glut of excess organic mass. To introduce limits to writhing and shitting. Chlorhydric acid.	Existence became a scarce product, and the nervebags came to detest the limits. Suffering was born. The second Triagon was content with its power. It was happy. Metabolic domination.	[EOL]
Levels\Bonus5.tscn	LINES			[node name="Body" parent="Civilian5" index="1"]	You're the one who moved into that old house? Know that you're not welcome here.	You won't last a month. Cityfuckers like you don't have the guts for real country life.	Wouldn't visit the town if I was you. Might get shot... People are on the edge with augmentoids like you.	Please leave. I don't want to be caught talking to a cityfucker.	Go. Now.	[EOL]
Levels\Bonus5.tscn	LINES			[node name="Body" parent="Civilian6" index="1"]	Name's Brad. I'm the village's carpenter.	I'm not like the others, I don't care where you're from. Business is business.	They detest me but none of them can work with wood at all. They tried and one of their houses ended up collapsing. They need me.	Still, I'd stay away from the village. You never know what those people will come up with next.	The air around here can cause severe psychological damage.	[EOL]
Levels\Bonus5.tscn	LINES			[node name="Body" parent="Civilian7" index="1"]	My traditional biotech remedies won't work on a disgusting augoid like you.	There's no saving you. I think you should be purified.	I have received the blessings of the Triagon.	[EOL]
Levels\BonusEND.tscn	LINES			[node name="Body" parent="Civilian2" index="0"]	Nyororororororon ahahaahaha weeeeeeeee! Ooohhhohohohohoho... AAAAAAAAAAAHHH.	[EOL]
Levels\Level1.tscn	LINES			[node name="Body" parent="Civilian2" index="1"]	Oh hey there.	I can see that they got you too.	Honestly it's not so bad. It's always good to have more options for nutrition, you end up saving a lot of money.	Reversing the process? Sounds unlikely.	Stay as long as you want. As far as I'm concerned we're family.	[EOL]
Levels\Level1.tscn	LINES			[node name="Body" parent="Civilian3" index="1"]	(This man is here to free me)	(What a beautiful angelic being...)	(I will now rest)	[EOL]
Levels\Level1.tscn	LINES			[node name="Body" parent="Civilian4" index="1"]	I used to work as a janitor here but then I found this place.	Now I live here rent free and steal company secrets from the lab's trash.	It wasn't always this nice here. I've put a lot of effort into renovation.	Please don't tell anyone about me. I don't want to go back to mopping the office floors. That place is rank.	[EOL]
Levels\Level1.tscn	LINES			[node name="Body" parent="Civilian5" index="1"]	Hello. Welcome to Pure Optics. I was informed you'd be coming here soon.	You're here for the procedure right? Life getting to you? Seems like it judging by your face.	Proceed down the hallway and use the soul emulator when you're ready. Everything's already been paid for so you don't have to worry.	After you're done you'll notice that things that previously seemed impossible are now easy, new openings presenting themselves to you every single day.	It's truly life-changing.	[EOL]
Levels\Level10.tscn	LINES			[node name="Body" parent="Worker" index="0"]	Good timing! I just now applied the finishing touches to this place.	[EOL]
Levels\Level10.tscn	LINES			[node name="Body" parent="Civilian2" index="1"]	(Hahaha... He can't see me.)	(...)	Wait, you know I'm here? How's that even possible?	The smell? God, should have known. I paid good money for this but it's completely useless. Just like me.	Despite having money I will never amount to anything. This is what it's like to be the child of a trillionaire. Ridiculous, pathetic.	[EOL]
Levels\Level10.tscn	LINES			[node name="Body" parent="Civilian" index="1"]	Stuck in a rut? The good people at Pure Optics will fix you right back up.	They have an office right next to that pharmaceutical company that caused the fleshrat infestation. I can't remember the name but I'm sure you can find it.	Good luck, I can see that you have what it takes to become a top exec.	[EOL]
Levels\Level11.tscn	LINES			[node name="Body" parent="elsa" index="0"]	Shouldn't you be at work?	Can't you see I've got a business to run?	I need to liquidate some assets.	The Psycho Freak Nootropic Company stock is down by 95%. Serves them right.	Business isn't just numbers on a screen. It's blood and guts. It's primal violence. If you can't handle that you should just jump out of that window.	All my decisions are based on the heat signature of the sun. The algorithm is proprietary.	Even if you kill me I'll always be here. You'll just ruin your life like the fuck-up you are.	You'll never figure it out, meathead.	[EOL]
Levels\Level11.tscn	LINES			[node name="Body" parent="SubArch1" index="1"]	I am fine, I shine, I am simply divine...	I am the head of the HR department around here. I am feared and loved.	Human resources... Simple material to be formed as I please, into my own image. That's how it goes here.	My dream, a large ball of human bodies rolling across vast plains, flattening everything it comes across.	Ahhh... I would love that.	[EOL]
Levels\Level11.tscn	LINES			[node name="Body" parent="SubArch2" index="1"]	I am a sad sack of shit. I huff and puff and suffer. I am number two.	I'm the Chief Technology Officer of this shitshow. I coordinate the code apes and make sure they're in pain as much as possible.	I've been getting really into \"hell\". Both as a mindset and as something to strive for, in an organizational sense.	There's something intensely beautiful about it.	Dreaming is important.	[EOL]
Levels\Level11.tscn	LINES			[node name="Body" parent="SubArch3" index="1"]	I am number three. I pulsate. I laugh.	I'm the Chief Security Officer. Chaos is imaginary... Time is a frigid crystal of perfect order. From any point in time it's trivial to calculate any other.	There's a limited number of possible steps. I can rotate time in my head.	My job is pretty pointless as security is inherent in everything. Some disagree with me. They suck.	I mostly just drink coffee and play with guns.	[EOL]
Levels\Level11.tscn	LINES			[node name="Body" parent="SubArch4" index="1"]	I don't really enjoy this number thing.	I'm the Chief Finances Officer. But I also handle other types of \"asset liquidations\".	Oh you work for me?	Since you're here... Could you deal with the others for me? I really hate this work environment. It needs a hard reset.	Oh you're here to do that? That's great!	Get to it then alright?	[EOL]
Levels\Level12.tscn	LINES			[node name="Body" parent="Civilian2" index="1"]	What are you doing here you absolute moron?	Can't you tell you shouldn't be here at all?	You better not touch any of my crap or you'll sorely regret it you dumbass.	There's some things people like you just shouldn't be allowed to mess with.	Get out.	[EOL]
Levels\Level2.tscn	LINES			[node name="Body" parent="Civilian" index="1"]	Hey what are you doing in my house?	Oh you're my new neighbor? But you don't seem nouveau riche like the rest of them... That's good.	You should shower sometimes, to make a better first impression.	The people moving here don't know what they're dealing with. The inverted sun glows underneath this accursed shithole.	It won't be long now before this place can be returned to its pristine flattened state. Hehehe...	Soon...	[EOL]
Levels\Level2.tscn	LINES			[node name="Body" parent="Civilian2" index="1"]	Don't mean to brag but the alphabet soup agencies have been tracking me for years.	I've been living in this compound all this time. Though I did have a short vacation in the alps just recently.	It's incredible that you can just live out your life as a fugitive in a gated community.	Those losers will never find me, and if they did they would have no chance against my elite security.	[EOL]
Levels\Level3.tscn	LINES			[node name="Body" parent="Node/Worker" index="0"]	I got sent here on a mission to kill the CEO.	I got scared so now I've been hiding out in this server room for two weeks.	I've been subsisting on hamburger leftovers left here by the server guy.	Maybe I can finally leave now that you're here.	[EOL]
Levels\Level3.tscn	LINES			[node name="Body" parent="Civilian3" index="1"]	What's that, you want to get into fishing?	Do you seriously have what it takes or do you just do whatever is trendy?	When I started fishing everyone made fun of me. Now they have the audacity to ask me for tips. Fuck them.	Well, you actually swam all the way here so maybe you're different.	Feel free to grab my old rod. I just ordered a new one from Fish&Fun. Should be a pretty decent upgrade.	[EOL]
Levels\Level4.tscn	LINES			[node name="Body" parent="Worker" index="0"]	I got locked up in here because someone saw me naked through my bedroom window. Can you believe it?	If anything whoever reported me should be locked up for stalking.	They said they're going to fine me for $20k. I'm already twice that in debt so it's not a big deal. Besides my credit score is good.	The police department is a business like any other huh...	[EOL]
Levels\Level4.tscn	LINES			[node name="Body" parent="Civilian" index="1"]	Mouse of pain... Mouse of shame. What are you here for?	I'm worried about your homunculus. It has been playing too many video games recently. It's important to take a 15 minute break once an hour.	Remember to eat, sleep and stay hydrated. That's my message to all beings of flesh.	Good luck on your travels, in this world and others.	[EOL]
