Cutscenes\CutsceneEnd3.tscn	visible			[node name="MarginContainer" type="MarginContainer" parent="."]	true	[EOL]
Cutscenes\CutsceneEnd3.tscn	anchor_left			[node name="MarginContainer" type="MarginContainer" parent="."]	0.5	[EOL]
Cutscenes\CutsceneEnd3.tscn	anchor_top			[node name="MarginContainer" type="MarginContainer" parent="."]	1.0	[EOL]
Cutscenes\CutsceneEnd3.tscn	anchor_right			[node name="MarginContainer" type="MarginContainer" parent="."]	0.5	[EOL]
Cutscenes\CutsceneEnd3.tscn	anchor_bottom			[node name="MarginContainer" type="MarginContainer" parent="."]	1.0	[EOL]
Cutscenes\CutsceneEnd3.tscn	margin_left			[node name="MarginContainer" type="MarginContainer" parent="."]	-88.0	[EOL]
Cutscenes\CutsceneEnd3.tscn	margin_top			[node name="MarginContainer" type="MarginContainer" parent="."]	-141.0	[EOL]
Cutscenes\CutsceneEnd3.tscn	margin_right			[node name="MarginContainer" type="MarginContainer" parent="."]	88.0	[EOL]
Cutscenes\CutsceneEnd3.tscn	margin_bottom			[node name="MarginContainer" type="MarginContainer" parent="."]	-89.0	[EOL]

Cutscenes\CutsceneEnd3.tscn	margin_left			[node name="Subtitle" type="Label" parent="MarginContainer/CenterContainer"]	88.0	[EOL]
Cutscenes\CutsceneEnd3.tscn	margin_top			[node name="Subtitle" type="Label" parent="MarginContainer/CenterContainer"]	9.0	[EOL]
Cutscenes\CutsceneEnd3.tscn	margin_right			[node name="Subtitle" type="Label" parent="MarginContainer/CenterContainer"]	88.0	[EOL]
Cutscenes\CutsceneEnd3.tscn	margin_bottom			[node name="Subtitle" type="Label" parent="MarginContainer/CenterContainer"]	42.0	[EOL]
Cutscenes\CutsceneEnd3.tscn	custom_colors/font_color			[node name="Subtitle" type="Label" parent="MarginContainer/CenterContainer"]	Color( 1, 1, 0, 1 )	[EOL]

Cutscenes\Consumerintro.tscn	DURATION			[node name="Spatial" type="Spatial"]	7	[EOL]
Cutscenes\Cutscene1.tscn	DURATION			[node name="Spatial" type="Spatial"]	6	6.0	6.0	6.0	6.0	6.0	6.0	6.0	6.0	6.0	6.0	6.0	6.0	6.0	4.0	[EOL]
Cutscenes\CutsceneEnd1.tscn	DURATION			[node name="Spatial" type="Spatial"]	13	7.0	7.0	7.0	7.0	7.0	7.0	7.0	7.0	7.0	20.0	100.0	[EOL]
Cutscenes\CutsceneEnd2.tscn	DURATION			[node name="Spatial" type="Spatial"]	13	7.0	7.0	7.0	7.0	7.0	7.0	7.0	7.0	7.0	20.0	100.0	[EOL]
Cutscenes\CutsceneEnd3.tscn	DURATION			[node name="Spatial" type="Spatial"]	16.0	8.5	8.5	8.5	8.5	17	10.7	10.7	10.6	17.0	8.2	8.2	8.2	8.2	33.2	7.8	3.4	3.4	3.4	6.0	[EOL]

Levels\Training_Level.tscn	DYN_LINES			[node name="Body" parent="NPC_Level_1" index="0"]	[SOB]	N	[EOB]	[SOB]	N	[EOB]	[SOB]	良くやった！あれがお前の最初のミッションだったなんて信じられん。	自分でやるつもりだったが忙しくてな。今私は自分のPMCを立ち上げる準備をしているんだよ。こういう仕事をするには歳を取りすぎた。ハハハ！	既に資金調達も完了して良い風向きでな、社員を募集する時に知らせるよ。気分転換したくなったら来てくれ。	お前がここまでやれるとは思わなかったぞ。	[EOB]	[SOB]	N	[EOB]	[SOB]	N	[EOB]	[SOB]	N	[EOB]	[SOB]	N	[EOB]	[SOB]	N	[EOB]	[SOB]	N	[EOB]	[SOB]	N	[EOB]	[SOB]	N	[EOB]	[SOB]	N	[EOB]	[SOB]	N	[EOB]	[EOL]
Levels\Training_Level.tscn	DYN_LINES			[node name="Body" parent="NPC_Level_2" index="0"]	[SOB]	N	[EOB]	[SOB]	N	[EOB]	[SOB]	\"N\"	[EOB]	[SOB]	私はG-Techの警備員として働いていたんだ。君が来て私を解放してくれるまではね。	とても有り難いことに、彼らの中の一人がずっと私に自分の\"Chunkopops\"を見せ続けてくれたんだ…	私の人生で最も悲惨な2ヶ月だったよ	ここには新しい仕事を探しに来たんだ。	[EOB]	[SOB]	N	[EOB]	[SOB]	N	[EOB]	[SOB]	N	[EOB]	[SOB]	N	[EOB]	[SOB]	N	[EOB]	[SOB]	N	[EOB]	[SOB]	N	[EOB]	[SOB]	N	[EOB]	[SOB]	N	[EOB]	[EOL]
Levels\Training_Level.tscn	DYN_LINES			[node name="Body" parent="NPC_Level_3" index="0"]	[SOB]	N	[EOB]	[SOB]	N	[EOB]	[SOB]	N	[EOB]	[SOB]	N	[EOB]	[SOB]	僕は労働者派遣会社のGutworxに解雇されたんだ。	しばらくは本当に落ち込んだよ。宇宙エレベーターの建設現場を掃除するのは本当に楽しかったんだ。	突然、経営方針の何かが変わって清掃員全員が追い出されたんだ…	有り難いことに、僕がこの新しい仕事に就くのに時間はかからなかった。清算人たちは行く先々で大きな混乱を残していくみたいだ。	初めて来たとき、ここは信じられないほど臭かった。	君は忙しそうなのに、こんな風に引き止めて悪かったね。	[EOB]	[SOB]	N	[EOB]	[SOB]	N	[EOB]	[SOB]	N	[EOB]	[SOB]	N	[EOB]	[SOB]	N	[EOB]	[SOB]	N	[EOB]	[SOB]	N	[EOB]	[SOB]	N	[EOB]	[EOL]
Levels\Training_Level.tscn	DYN_LINES			[node name="Body" parent="NPC_Level_4" index="0"]	[SOB]	N	[EOB]	[SOB]	N	[EOB]	[SOB]	N	[EOB]	[SOB]	N	[EOB]	[SOB]	N	[EOB]	[SOB]	本当に君がPD（訳注：Police Departmentの略。警察署）を爆破したのか、んん？私は君を責めないがね。	人々は権力争いやステロイドの新たな供給源を見つけるために争ったりして、この場所全体が完全に混乱している状態だ。	しばらくの間、ここを辞めようと思っていたんだ。抑圧的な職場環境が私には合わなかったからね。	色々な条件を考えると民間警備会社が自明の選択だったのでね、今ここにいるという訳だ。勤務時間も自分で決められるし、最高だな！	君が最終的に私の人生の流れを変える機会を与えてくれたことにはとても感謝しているよ。事態は好転しているんだ。	[EOB]	[SOB]	N	[EOB]	[SOB]	N	[EOB]	[SOB]	N	[EOB]	[SOB]	N	[EOB]	[SOB]	N	[EOB]	[SOB]	N	[EOB]	[SOB]	N	[EOB]	[EOL]
Levels\Training_Level.tscn	DYN_LINES			[node name="Body" parent="NPC_Level_5" index="0"]	[SOB]	N	[EOB]	[SOB]	N	[EOB]	[SOB]	N	[EOB]	[SOB]	N	[EOB]	[SOB]	N	[EOB]	[SOB]	N	[EOB]	[SOB]	俺はMegamallでの仕事をクビになってしまったんだが、これはGurneyの集会のときの警備の対応の不備が原因なんだ。	警察のdeathmechがあちこちにいたのに、他に何ができたって言うんだ？	今はここで経理をやっている。それほど悪くないぜ。仕事のコツもつかみ始めているしな。	この部屋は前の部屋よりずっといい感じだ。	[EOB]	[SOB]	N	[EOB]	[SOB]	N	[EOB]	[SOB]	N	[EOB]	[SOB]	N	[EOB]	[SOB]	N	[EOB]	[SOB]	N	[EOB]	[EOL]

Cutscenes\Cutscene1.tscn	LINES			[node name="Spatial" type="Spatial"]				もしもし、私だ。\n憂鬱なお昼寝の時間の邪魔をしてしまったか？	お前はSEC Death Unitからの除隊以来ずいぶん荒れていると聞いたぞ。	結局のところ、お前みたいなはぐれ者の負け犬にできることなんて\nたかが知れているということだ。	今日はそんな負け犬にとても良い話を持ってきたぞ。	これはお前が楽しくこなせる類の仕事のはずだ。\nだが企業の流儀というものに馴染んでもらう必要がある。	仕事をいつでも始められるようにMyWorkのアカウントをこちらで作っておいた。	お前ならこの種の仕事に適した装備を持っているだろう。	最後にもうひとつ、この仕事では監督アプリで\n1日最低15分のログを取る必要がある。	お前には良好かつ明瞭な精神を保つ事を求めているのだ。\n怯えて取り乱したりするな。分かったな？	言いたい事はそれだけだ。\n新しいキャリアパスでの幸運を祈る。			[EOL]
Cutscenes\CutsceneEnd1.tscn	LINES			[node name="Spatial" type="Spatial"]		お前は長く退屈な眠りから目覚める。	世界はどれをとっても等価な機会が散りばめられた\n巨大で平坦な平面として姿を表す。	空は果てしなく青い。	お前は友に囲まれている。	空気は新鮮で、海の香りがする。	お前は受容と許しを学んだ。	しかし知識と理解が欠けている。	お前は永遠に囚われの身となるだろう。	過去は常にそこに在る。	そして太陽は永遠の悪意を持ってお前に微笑みかける。		[EOL]
Cutscenes\CutsceneEnd2.tscn	LINES			[node name="Spatial" type="Spatial"]		私は涙を流す。	お前は腐った抜け殻だ。	お前は無限の力に満ち溢れている。	お前は皇帝の魂を持つ。	原初の幸運に祝福された生贄の英雄だ。	仲間たちは地獄にいるというのにお前は微笑む。	お前のような者には良い事しか訪れない。	目標を定めよ。10年の計画を持て。投資せよ。早起きしろ。\nCEOのマインドセットを獲得するのだ。	幸運を祈る。			[EOL]
Cutscenes\CutsceneEnd3.tscn	LINES			[node name="Spatial" type="Spatial"]		地平線の一点、子供の頃の優しい光景。死の運命が現れ始める。\n無に向かう狂気の彷徨、呪われた無限の循環を定められし生物学。\n歯には歯を。噛みつくのだ。	海岸の町の穏やかな香り、太陽の暖かさ。苦い涙。権力への渇望。\n此処こそお前が夢を捨てた地。\nお前は富裕層、痛ましいトラウマを拡大する渦。	ついには美しくクソ厚かましい猿となる。\n純粋な魂が誕生し、その神経伝達は途切れがちとなる。\nその処理数はナノ秒あたり30583750937509353回だ。	美しさはお前の穴だらけの心をすり抜けていく。		人生の価値はマイナスだ。存在の天秤は38度傾いている。\n表面はひび割れだらけで、膨張した光がすり抜けている。\n肉付きのよい原初の身体はだらだらと斜面を転がり落ちる。	お前だけが神々しい足取りでそっと昇っていく。\nお前は美化され聖人のような姿となる。\nお前の無垢な愚かさは、見通せない人生の霧を通り抜ける安全な道を明らかにする。	お前の鈍らな剣は、腐敗の園の弱い腱や膜を切り裂く。\n満足と興奮の玉座に座れ。お前の王国の永遠の青空をよく見るのだ。\nお前はあることに気づく。そして玉葱を手に取り、皮をむき始める。		玉葱の層1。玉葱の層2。玉葱の層3。玉葱の層n^n。\n永い年月が過ぎ、玉葱の皮は完全に剥かれた。何も残っていない。完全に。\nお前はかつて玉葱があった場所、その一点に迷い込む。	シナプスカスケード、神経学的カタストロフ。\nその点は無限に密度を増し、宇宙は単細胞の存在へと凝縮する。\nそれは罪を叫ぶ。幸福を切望する。	この世界は終わった。自殺を試みるが失敗。悲しく惨めな混乱。\nお前は哀れみと嫌悪を感じる。\nある意味で純粋な恩寵を持つ存在だけができる方法によって。	お前はその暴力的な慈悲で、この世界に終止符を打つ。		生きている有機体、\nそれも地球上でのエネルギー作用によって生存を左右される状況にある、\nは大抵の場合において生命維持に必要な量以上のエネルギーを受け取っている；	そして過剰なエネルギー（富）は\nシステム（例えば有機体）の成長のために使うことができる；	しかしシステムがもはや成長することができない場合、\nあるいはシステムが成長する中で余剰分を完全に吸収することができない場合、	望むも望まざるも、良いも悪いも拘わらずに、\nそれは必然的に何の利益も齎さず失われてしまう。\n- ジョルジュ・バタイユ		[EOL]
Entities\Enemies\Chaos_Objective.tscn	LINES			[node name="Body" type="KinematicBody" parent="."]	Eko wls uoarjc pfs wqr fbs\nFor ycf bazjkd szk ezt blp\nZas oai xhvgmq ktl spy\nQEVHUMDKGTASLFNEVHUMDKGTASLFN	[EOL]
Entities\Enemies\E_Civilian_Mutant.tscn	LINES			[node name="Body" type="KinematicBody" parent="."]	AAAAAAAAAAAAAAAAAAAAAAAAAAAAAAAAAAAAAAAAAAAAAAAAAAAAAAAAAAAAAA	[EOL]
Entities\Enemies\E_Cocky.tscn	LINES			[node name="Body" type="KinematicBody" parent="."]	やぁ、はじめまして。名前はKevinだけどKevって呼んでね。	ここのspeculative architect（思弁設計者）なんだ。\nいや…、設計はしてないよ。	僕はただ建物が、あー、僕たち以外の現地民たち（alternativies）に\nどんな風に見えているかを考えるためにここにいるんだ。	今は\"In suffering（苦難の中で）\"と題して建築表現のシリーズを作ってる。	最近の作品に「苦境におけるマネージメント力の浪費」\nっていうのがあるんだけど傑作だよ。	こいつはかなり重要な仕事でね。おかげで最近昇進したから2階に良い感じのオフィスをもらったのさ。\n小部屋しかもらえない負け犬たちから離れた所にだよ。	僕はfleshnetで刊行している\"Successful Architecture（成功した設計者）\"\nの編集もしているんだ。かなりイケてるよ。いつかチェックしてみてね。	[EOL]
Entities\Enemies\E_Kevin.tscn	LINES			[node name="Body" type="KinematicBody" parent="."]	やぁ、はじめまして。名前はKevinだけどKevって呼んでね。	ここのspeculative architect（思弁設計者）なんだ。\nいや…、設計はしてないよ。	僕はただ建物が、あー、僕たち以外の現地民たち（alternativies）に\nどんな風に見えているかを考えるためにここにいるんだ。	今は\"In suffering（苦難の中で）\"と題して建築表現のシリーズを作ってる。	最近の作品に「苦境におけるマネージメント力の浪費」\nっていうのがあるんだけど傑作だよ。	こいつはかなり重要な仕事でね。おかげで最近昇進したから2階に良い感じのオフィスをもらったのさ。\n小部屋しかもらえない負け犬たちから離れた所にだよ。	僕はfleshnetで刊行している\"Successful Architecture（成功した設計者）\"\nの編集もしているんだ。かなりイケてるよ。いつかチェックしてみてね。	[EOL]
Entities\Enemies\Obj_Nerd_1.tscn	LINES			[node name="Body" type="KinematicBody" parent="."]	あんた誰？あー、僕のChunkopopを見に来たの？	僕はこのチビ助たちに目がないんだ。もう$100000以上使ってるんじゃないかな。	お気に入りはある？え、僕？選ぶのは難しいなぁ。\nこいつらはみんな僕の子供たちだから。	他のChunkoマニアに会えてホントにうれしいよ…	[EOL]
Entities\Enemies\Obj_Nerd_2.tscn	LINES			[node name="Body" type="KinematicBody" parent="."]	Qurpitを知っているか？一語による表現（One word）：分散型個人用サーバー。あんたのデータを取り戻せ。	理解できないのか？ふぅ、典型的な地球人だな…	今オレはZoonっていう水星人のためのQurpitプログラミング言語を理解しようとしてるんだ。ほっといてくれ。	[EOL]
Entities\Enemies\Obj_Nerd_3.tscn	LINES			[node name="Body" type="KinematicBody" parent="."]	お前は誰だ？	ここから出て行け。	一人にしてくれ。	今オレはお前になんて言った？	オレはここで仕事をしようとしているんだ。	お前は助けにならない。	お前をヤるくらい簡単（piece of piss）なんだぞ。	…	[EOL]
Entities\Enemies\Obj_Pinky.tscn	LINES			[node name="Body" type="KinematicBody" parent="."]	AAAAAHHHHHH!!!	生体づうが（BIOGURRNGY）!!! 私は金だ… 私は神だ!	投資だ。研究だ。（INVEST. INVESTIGATE.）通貨の未来だ。	SLURPCOIN DOT COM. FLIPPERBUCKS. 私の体を生体通貨（BIOCURRENCY）端末に繋ぐ。未来	UUUUUUOOOHHHHHHHOOHOHHOOHHOOHOHHOHOHHOOHHOOHOHHOHOHOHOHHOOHOOHOHOHOHOHOHOOHOHHOOHHOHOHOHHOOHOHOHOOOO	[EOL]
Levels\Bonus1.tscn	LINES			[node name="Body" parent="Creep" index="1"]	おぉー、ヤツが来るぞ、これを待っていた。	蹴られるのか、頭を撃たれるのか。超エキサイティングだ。	ま、前回は息をのむほどだったからねぇ。あれを上回ることはできないだろうな。	オレは屋根から蹴り落とされるのが良いなぁ。	次に何が起こるかわからない。それが人生の素晴らしさだ。	オレは君の仕事を尊敬しているよ。最後に残された数少ない名誉ある仕事だからね。	Ahhhaha...	Mhhmmm...	[EOL]
Levels\Bonus1.tscn	LINES			[node name="Body" parent="Civilian2" index="1"]	私は高価なゲーミングPCでShitville Farmhouseを何度もプレイするうちに、ファーミングにのめり込んでいった。	しかしある時点で飽きてしまったので、現実で本物の農業（farming）を始めることにした。	だからビデオゲームの中ではなく、こうして自分の農業をやっている。	大変な仕事も他人にやらせればいいだけだから、ゲームよりずっと楽だよ。	今Darkworldではslurpnip（訳注：slurp→音を立てて食べる，nip→噛む）のシーズンだ。	[EOL]
Levels\Bonus2.tscn	LINES			[node name="Body" parent="Civilian3" index="1"]	あと1年もすれば引退するのに十分なお金が手に入る。	このリゾートビジネスは私には向いていない。文句ばかりで私よりここの運営方法を知っていると言わんばかりの客どもめ。	ウォータースライダーは絶対に作らないって言っているだろうが。設置できる場所なんてどこにあるんだ？	はぁ…もっと面の皮を厚くしないと。	聞いてくれてありがとう。少し気が楽になった。こんなこと誰にも言えないよ。	[EOL]
Levels\Bonus2.tscn	LINES			[node name="Body" parent="Civilian4" index="1"]	バスルームのアレを何とかしてくれ！	何なんだあの変人は。swampの奴らなのは知ってるけど、僕にはちょっとぐちゃぐちゃ（swampy）すぎるよ。	何時間も前にホテルの管理者に電話したのにまだ来ないんだ。なんてこった。	うちの警備員は完全に臆病者で、中に入るのを拒否している。誰がこんなバカを雇ったんだ？	この件に対処してくれたら、金だって払うよ。100万ドルでどうだ？	[EOL]
Levels\Bonus2.tscn	LINES			[node name="Body" parent="Civilian5" index="1"]	俺はお前みたいな変人に邪魔されない事には小便すらできないのか。	どうした？早くしろ。	この旅は大失敗だ。取引は全て駄目になった。破産宣告も覚悟している。	他の連中は\"リラックス\"に 興味があるようだ。真面目に仕事してるのは俺だけだ。	お前も？そいつは良い。	[EOL]
Levels\Bonus2.tscn	LINES			[node name="Body" parent="Civilian" index="0"]	落ち着け兄弟…どこから来たんだ？	俺はちょっと冷えてるんでね、静かな景色と温かい風呂が恋しい気分なんだ。何人かはビジネスをしたがっていたが俺は急いでない。	正直なところ、ここに来る前から取引はないだろうと思っていた。ただリラックスする口実が欲しかっただけだ。	またいつか必ず来るよ。もしここのオーナーに会ったら彼の仕事に感謝していると伝えてくれ。	[EOL]
Levels\Bonus2.tscn	LINES			[node name="Body" parent="Civilian2" index="0"]	お前はあの脳足りんの爺がこの立派なホテルの経営者だと思ったのか？	こんな重要なことはあんな奴に任せておけない。	私は代々受け継いだ闇のCEOだ。一種の企業貴族だ。私たちは世間の注目ではなく純粋なビジネスだけを考えている。	弱者の血など取るに足らないが、最近は誰もがチャンスを望んでいる。酷い話だ…	思うに、だ。	私のような頭脳は慎重な交配なしでは得られないのではないか…	[EOL]
Levels\Bonus3.tscn	LINES			[node name="Body" parent="Civilian2" index="1"]	私が君だったら見なかった事にするね。	何が起こっているのかよくわからないが、良くないことなんだろう。	君は貧乏旅行者ですか？あぁ…	[EOL]
Levels\Bonus3.tscn	LINES			[node name="Body" parent="Civilian3" index="1"]	この家にはもう私しか残っていない…	奴らが毎晩やってきては誰かをさらっていく。連れ去り先の場所も理由もわからない。	以前は妻とクソ…居候と一緒に住んでいたんだ。決して裕福ではなかったが、シンプルで気ままな暮らしだった。	私は奴らが来る前に 自殺しようと思っている。単刀直入で申し訳ない。でもあなたは奴らを見ていない。	私は昔ある企業のVIPだったんだが、そんな生活は肌に合わなかった。だからこの良い家を買って落ち着いたんだ。	事態が悪化し始めたのは、ここ数ヶ月のことだ。土が腐り肉の腐ったような臭いがし始め、作物はすべて枯れてしまった。	それから奴らが私たちに嫌がらせをするようになった。私の家族だけでなく、この地域に住むすべての人にだ。	それはだんだん酷くなっていき、今では皆いなくなってしまった。	妻を探すのを手伝ってくれないか？とても寂しいんだ…	[EOL]
Levels\Bonus3.tscn	LINES			[node name="Body" parent="Civilian4" index="0"]	なんてこった！私を捕まえに来たのか？私が何をした？	誓って言うが、私はここの皆の生活を良くしようとしているだけだ。	Godhead Heavy Industriesで働くのはもう耐えられない。あそこは魂が吸い取られる倫理観ゼロの職場だ。	Veggo's Meatoidは俺の子だ… 100%植物由来のビーガン肉で世界をより良い場所にするためにやっと何かできるんだ。	厳密に言うとこれはヴィーガンではないけれど、地球が実際に何かを感じられるわけじゃない。	そうである事を願うよ…	[EOL]
Levels\Bonus3.tscn	LINES			[node name="Body" parent="Civilian" index="0"]	あのクソみたいな小さな農家のオーナーに会ったかい？あいつはいつも泣き言ばかりで何もしないんだ。	俺はここに住んで5年になるが、常に最悪の事態に備えている。あの鉱山に住む変人どもを皆殺しにする計画を立てているんだ。	そして俺はその経験を本にするのさ。タイトルは\"The Destruction of Virility: Doom Anus Apocalypse\"（訳注：「漢の破壊：破滅のケツ穴黙示録」）だ。	これが俺の田舎での生活って奴だ。もう都会には戻らない。	[EOL]
Levels\Bonus3.tscn	LINES			[node name="Body" parent="Civilian18" index="0"]	ああ！俺はここでとても楽しい時間を過ごしている！	ここは信じられないほどヌレヌレでビクビク脈打つ穴でいっぱいだ。俺のような男が必要とするものだ。	チャンスは無限だ。想像力を働かせろ。	[EOL]
Levels\Bonus4.tscn	LINES			[node name="Body" parent="Civilian2" index="1"]	うわぁ、あんたクールだな。いい格好だ。	俺はEarl。このイカした複合クラブを経営してるんだ。昔は何かの工場だったんだが、ヘへ、今はきれいにしてスゲーいい感じなんだ。	俺はこの古い住宅街の半分を買ったおかげでクッッッッッッッッソ金持ちになった。	高級車…高級ウォッカ…ゲーミングBIOPOD、あんたが挙げられるような物は何でも持ってる。	俺は今もう1つ別の住宅街を狙ってるんだ。まだ誰もこのビジネスを思いつかないなんて信じられない。簡単だし100％合法だ。	俺は\"パーティーシンドローム\"に罹っているんだぜ…	[EOL]
Levels\Bonus5.tscn	LINES			[node name="Body" parent="Civilian2" index="1"]	最初のTriagonは悪意から生まれた。それは太陽への恐怖の流れを両手で掴み、この破滅的な世界の上に止まった。病原菌の誕生だ。	それは力のベールを越えて太陽を見上げた。そしてその膨らんだ血管の腕を境界線を越えて伸ばし、その分け前を奪った。病気が広がる。	病原菌は生物学的形状を完全にコントロールするようになった。それは技術進歩の原動力となった。そして全てが捻れ、回転し、脈動し、噴出した。こうして感染は決定的なものとなった。	[EOL]
Levels\Bonus5.tscn	LINES			[node name="Body" parent="Civilian4" index="1"]	第3のTriagonは死から生まれた。それは世界が過剰なエネルギーを放出しているのを見た。それは偉大なことを実行に移したかった。しかし自らが価値を持たずして偉大な事は実現できなかった。最初の取引である。	それは刃を持ち境界線に大きな穴を開け、大量の活用可能な力の閃光を生み出した。そしてほんの一瞬で自らの中に価値を、魂を染み込ませた。第2の取引である。	穴はすぐに修復され圧倒的な価値の伝達は途絶えた。しかしその瞬間、原初の金融力の種が蒔かれ世界は取引の形をとった。対立と不和が生まれ、第3のTriagonは恍惚とした。第3の取引である。	[EOL]
